{
  "schemaVersion": "1.0.0",
  "roles": [
    {
      "roleId": "critical-reasoning",
      "capabilityTier": "sol",
      "allowedOperations": ["compose-plan", "review-plan", "revise-plan", "perform-change", "assess-change", "record-decision", "prepare-handoff"],
      "fallbackRoleIds": [],
      "ollamaEligible": false
    },
    {
      "roleId": "implementation",
      "capabilityTier": "terra",
      "allowedOperations": ["revise-plan", "perform-change", "record-decision", "prepare-handoff"],
      "fallbackRoleIds": ["critical-reasoning"],
      "ollamaEligible": false
    },
    {
      "roleId": "structured-writing",
      "capabilityTier": "luna",
      "allowedOperations": ["prepare-handoff"],
      "fallbackRoleIds": ["implementation", "critical-reasoning"],
      "ollamaEligible": false
    }
  ],
  "ollama": {
    "enabled": false,
    "qualifiedProfiles": []
  },
  "review": {
    "requiredBackend": "codex"
  }
}
